{
  "registryName": "SDS Design System",
  "version": "1.0.0",
  "componentSource": "/Users/stevewitmer/local_AI_Projects/sds/src/components",
  "componentPatterns": ["**/*.tsx", "**/*.jsx", "**/*.component.tsx"],
  "tokens": "./tokens/index.json",
  "output": "./sds-output/registry.json",
  "llmEnrich": true,
  "schemaVersion": "2024-03"
}
